{
  "name": "quiet-plugin",
  "displayName": "Quiet Plugin",
  "version": "1.0.0",
  "description": "Fixture plugin used by the repository test suite; never published.",
  "author": {
    "name": "Galaxio Team",
    "url": "https://github.com/galax-io"
  },
  "homepage": "https://github.com/galax-io/ai-plugins",
  "repository": "https://github.com/galax-io/ai-plugins",
  "license": "Apache-2.0",
  "keywords": [
    "fixture"
  ],
  "category": "developer-tools",
  "tags": [
    "fixture"
  ],
  "components": {
    "skills": "./skills/",
    "agents": null,
    "rules": null,
    "hooks": null,
    "mcpServers": null
  },
  "codex": {
    "interface": {
      "displayName": "Demo Plugin",
      "shortDescription": "Fixture plugin for the test suite",
      "category": "Developer Tools"
    }
  }
}
